    1   0.000000 192.168.20.140 → 192.168.20.254 DHCP 590 DHCP Request  - Transaction ID 0xd8559b71
    2   0.001489 192.168.20.254 → 192.168.20.140 DHCP 342 DHCP ACK      - Transaction ID 0xd8559b71
    3  18.333622 192.168.20.140 → 192.168.20.137 TCP 74 39443 → 80 [SYN] Seq=0 Win=5840 Len=0 MSS=1460 SACK_PERM=1 TSval=165961 TSecr=0 WS=16
    4  18.334225 192.168.20.137 → 192.168.20.140 TCP 74 80 → 39443 [SYN, ACK] Seq=0 Ack=1 Win=5792 Len=0 MSS=1460 SACK_PERM=1 TSval=145942503 TSecr=165961 WS=4
    5  18.334615 192.168.20.140 → 192.168.20.137 TCP 66 39443 → 80 [ACK] Seq=1 Ack=1 Win=5840 Len=0 TSval=165962 TSecr=145942503
    6  31.018224 192.168.20.140 → 192.168.20.137 TCP 81 GET / HTTP/1.0  [TCP segment of a reassembled PDU]
    7  31.018603 192.168.20.137 → 192.168.20.140 TCP 66 80 → 39443 [ACK] Seq=1 Ack=16 Win=5792 Len=0 TSval=145943771 TSecr=169134
    8  32.632866 192.168.20.140 → 192.168.20.137 HTTP 67 GET / HTTP/1.0 
    9  32.633298 192.168.20.137 → 192.168.20.140 TCP 66 80 → 39443 [ACK] Seq=1 Ack=17 Win=5792 Len=0 TSval=145943932 TSecr=169538
   10  32.641138 192.168.20.137 → 192.168.20.140 HTTP 811 HTTP/1.1 200 OK  (text/html)
   11  32.641382 192.168.20.140 → 192.168.20.137 TCP 66 39443 → 80 [ACK] Seq=17 Ack=746 Win=7344 Len=0 TSval=169540 TSecr=145943933
   12  32.642053 192.168.20.137 → 192.168.20.140 TCP 66 80 → 39443 [FIN, ACK] Seq=746 Ack=17 Win=5792 Len=0 TSval=145943933 TSecr=169540
   13  32.642362 192.168.20.140 → 192.168.20.137 TCP 66 39443 → 80 [FIN, ACK] Seq=17 Ack=747 Win=7344 Len=0 TSval=169540 TSecr=145943933
   14  32.642759 192.168.20.137 → 192.168.20.140 TCP 66 80 → 39443 [ACK] Seq=747 Ack=18 Win=5792 Len=0 TSval=145943933 TSecr=169540
   15  42.627469 192.168.20.140 → 192.168.20.2 DNS 77 Standard query 0x0f3b A www.trustwave.com
   16  42.681692 192.168.20.2 → 192.168.20.140 DNS 107 Standard query response 0x0f3b A www.trustwave.com CNAME trustwave.com A 64.194.204.130
   17  42.682711 192.168.20.140 → 64.194.204.130 ICMP 98 Echo (ping) request  id=0x7a16, seq=1/256, ttl=64
   18  43.683144 192.168.20.140 → 64.194.204.130 ICMP 98 Echo (ping) request  id=0x7a16, seq=2/512, ttl=64
   19  44.682703 192.168.20.140 → 64.194.204.130 ICMP 98 Echo (ping) request  id=0x7a16, seq=3/768, ttl=64
   20  45.683280 192.168.20.140 → 64.194.204.130 ICMP 98 Echo (ping) request  id=0x7a16, seq=4/1024, ttl=64
   21  46.683063 192.168.20.140 → 64.194.204.130 ICMP 98 Echo (ping) request  id=0x7a16, seq=5/1280, ttl=64
   22  47.682984 192.168.20.140 → 64.194.204.130 ICMP 98 Echo (ping) request  id=0x7a16, seq=6/1536, ttl=64
   23  55.393615 192.168.20.140 → 192.168.20.2 DNS 73 Standard query 0x1a6a A www.yahoo.com
   24  55.469498 192.168.20.2 → 192.168.20.140 DNS 127 Standard query response 0x1a6a A www.yahoo.com CNAME www.yahoo-ht3.akadns.net A 69.147.76.15
   25  55.470428 192.168.20.140 → 69.147.76.15 ICMP 98 Echo (ping) request  id=0x7b16, seq=1/256, ttl=64
   26  55.511650 69.147.76.15 → 192.168.20.140 ICMP 98 Echo (ping) reply    id=0x7b16, seq=1/256, ttl=128 (request in 25)
   27  55.512122 192.168.20.140 → 192.168.20.2 DNS 85 Standard query 0xe88c PTR 15.76.147.69.in-addr.arpa
   28  55.751383 192.168.20.2 → 192.168.20.140 DNS 123 Standard query response 0xe88c PTR 15.76.147.69.in-addr.arpa PTR f1.www.vip.re1.yahoo.com
   29  56.470986 192.168.20.140 → 69.147.76.15 ICMP 98 Echo (ping) request  id=0x7b16, seq=2/512, ttl=64
   30  56.535821 69.147.76.15 → 192.168.20.140 ICMP 98 Echo (ping) reply    id=0x7b16, seq=2/512, ttl=128 (request in 29)
   31  56.536230 192.168.20.140 → 192.168.20.2 DNS 85 Standard query 0xe31a PTR 15.76.147.69.in-addr.arpa
   32  56.565213 192.168.20.2 → 192.168.20.140 DNS 123 Standard query response 0xe31a PTR 15.76.147.69.in-addr.arpa PTR f1.www.vip.re1.yahoo.com
   33  57.471104 192.168.20.140 → 69.147.76.15 ICMP 98 Echo (ping) request  id=0x7b16, seq=3/768, ttl=64
   34  57.513976 69.147.76.15 → 192.168.20.140 ICMP 98 Echo (ping) reply    id=0x7b16, seq=3/768, ttl=128 (request in 33)
   35  57.514408 192.168.20.140 → 192.168.20.2 DNS 85 Standard query 0xa258 PTR 15.76.147.69.in-addr.arpa
   36  57.543472 192.168.20.2 → 192.168.20.140 DNS 123 Standard query response 0xa258 PTR 15.76.147.69.in-addr.arpa PTR f1.www.vip.re1.yahoo.com
   37  58.470104 192.168.20.140 → 69.147.76.15 ICMP 98 Echo (ping) request  id=0x7b16, seq=4/1024, ttl=64
   38  58.514108 69.147.76.15 → 192.168.20.140 ICMP 98 Echo (ping) reply    id=0x7b16, seq=4/1024, ttl=128 (request in 37)
   39  58.514522 192.168.20.140 → 192.168.20.2 DNS 85 Standard query 0xd297 PTR 15.76.147.69.in-addr.arpa
   40  58.543267 192.168.20.2 → 192.168.20.140 DNS 123 Standard query response 0xd297 PTR 15.76.147.69.in-addr.arpa PTR f1.www.vip.re1.yahoo.com
   41  59.469111 192.168.20.140 → 69.147.76.15 ICMP 98 Echo (ping) request  id=0x7b16, seq=5/1280, ttl=64
   42  59.512950 69.147.76.15 → 192.168.20.140 ICMP 98 Echo (ping) reply    id=0x7b16, seq=5/1280, ttl=128 (request in 41)
   43  59.513391 192.168.20.140 → 192.168.20.2 DNS 85 Standard query 0x97bb PTR 15.76.147.69.in-addr.arpa
   44  59.542645 192.168.20.2 → 192.168.20.140 DNS 123 Standard query response 0x97bb PTR 15.76.147.69.in-addr.arpa PTR f1.www.vip.re1.yahoo.com
   45  77.556156 192.168.20.140 → 192.168.20.137 TCP 74 56155 → 4456 [SYN] Seq=0 Win=5840 Len=0 MSS=1460 SACK_PERM=1 TSval=180773 TSecr=0 WS=16
   46  77.556629 192.168.20.137 → 192.168.20.140 TCP 60 4456 → 56155 [RST, ACK] Seq=1 Ack=1 Win=0 Len=0
   47 130.261946 192.168.20.140 → 192.168.20.137 DNS 74 Standard query 0xea3f ANY www.google.com
   48 130.264121 192.168.20.137 → 192.168.20.140 DNS 166 Standard query response 0xea3f ANY www.google.com CNAME www.l.google.com NS ns4.google.com NS ns1.google.com NS ns2.google.com NS ns3.google.com
   49 151.292910 192.168.20.140 → 192.168.20.2 DNS 77 Standard query 0xa7d0 A securityfocus.com
   50 151.336410 192.168.20.2 → 192.168.20.140 DNS 125 Standard query response 0xa7d0 A securityfocus.com A 205.206.231.12 A 205.206.231.15 A 205.206.231.13
   51 151.341410 192.168.20.140 → 205.206.231.12 TCP 74 43247 → 80 [SYN] Seq=0 Win=5840 Len=0 MSS=1460 SACK_PERM=1 TSval=199226 TSecr=0 WS=16
   52 151.378974 205.206.231.12 → 192.168.20.140 TCP 60 80 → 43247 [SYN, ACK] Seq=0 Ack=1 Win=64240 Len=0 MSS=1460
   53 151.379025 192.168.20.140 → 205.206.231.12 TCP 54 43247 → 80 [ACK] Seq=1 Ack=1 Win=5840 Len=0
   54 151.383745 192.168.20.140 → 205.206.231.12 HTTP 457 GET / HTTP/1.1 
   55 151.383981 205.206.231.12 → 192.168.20.140 TCP 60 80 → 43247 [ACK] Seq=1 Ack=404 Win=64240 Len=0
   56 151.422095 205.206.231.12 → 192.168.20.140 HTTP 548 HTTP/1.1 302 Found  (text/html)
   57 151.422125 192.168.20.140 → 205.206.231.12 TCP 54 43247 → 80 [ACK] Seq=404 Ack=495 Win=6432 Len=0
   58 151.438096 192.168.20.140 → 192.168.20.2 DNS 81 Standard query 0x6964 A www.securityfocus.com
   59 151.474785 192.168.20.2 → 192.168.20.140 DNS 129 Standard query response 0x6964 A www.securityfocus.com A 205.206.231.13 A 205.206.231.12 A 205.206.231.15
   60 151.479095 192.168.20.140 → 205.206.231.13 TCP 74 35002 → 80 [SYN] Seq=0 Win=5840 Len=0 MSS=1460 SACK_PERM=1 TSval=199260 TSecr=0 WS=16
   61 151.515733 205.206.231.13 → 192.168.20.140 TCP 60 80 → 35002 [SYN, ACK] Seq=0 Ack=1 Win=64240 Len=0 MSS=1460
   62 151.515781 192.168.20.140 → 205.206.231.13 TCP 54 35002 → 80 [ACK] Seq=1 Ack=1 Win=5840 Len=0
   63 151.520219 192.168.20.140 → 205.206.231.13 HTTP 461 GET / HTTP/1.1 
   64 151.520561 205.206.231.13 → 192.168.20.140 TCP 60 80 → 35002 [ACK] Seq=1 Ack=408 Win=64240 Len=0
   65 151.562879 205.206.231.13 → 192.168.20.140 TCP 386 HTTP/1.1 200 OK  [TCP segment of a reassembled PDU]
   66 151.562911 192.168.20.140 → 205.206.231.13 TCP 54 35002 → 80 [ACK] Seq=408 Ack=333 Win=6432 Len=0
   67 151.565363 205.206.231.13 → 192.168.20.140 TCP 1182 80 → 35002 [PSH, ACK] Seq=333 Ack=408 Win=64240 Len=1128 [TCP segment of a reassembled PDU]
   68 151.565398 192.168.20.140 → 205.206.231.13 TCP 54 35002 → 80 [ACK] Seq=408 Ack=1461 Win=9024 Len=0
   69 151.600746 205.206.231.13 → 192.168.20.140 TCP 1514 80 → 35002 [PSH, ACK] Seq=1461 Ack=408 Win=64240 Len=1460 [TCP segment of a reassembled PDU]
   70 151.600789 192.168.20.140 → 205.206.231.13 TCP 54 35002 → 80 [ACK] Seq=408 Ack=2921 Win=11680 Len=0
   71 151.600889 205.206.231.13 → 192.168.20.140 TCP 1514 80 → 35002 [PSH, ACK] Seq=2921 Ack=408 Win=64240 Len=1460 [TCP segment of a reassembled PDU]
   72 151.600906 192.168.20.140 → 205.206.231.13 TCP 54 35002 → 80 [ACK] Seq=408 Ack=4381 Win=14600 Len=0
   73 151.602789 205.206.231.13 → 192.168.20.140 TCP 1514 80 → 35002 [ACK] Seq=4381 Ack=408 Win=64240 Len=1460 [TCP segment of a reassembled PDU]
   74 151.602829 192.168.20.140 → 205.206.231.13 TCP 54 35002 → 80 [ACK] Seq=408 Ack=5841 Win=17520 Len=0
   75 151.602893 205.206.231.13 → 192.168.20.140 TCP 1514 80 → 35002 [PSH, ACK] Seq=5841 Ack=408 Win=64240 Len=1460 [TCP segment of a reassembled PDU]
   76 151.602908 192.168.20.140 → 205.206.231.13 TCP 54 35002 → 80 [ACK] Seq=408 Ack=7301 Win=20440 Len=0
   77 151.618848 192.168.20.140 → 205.206.231.13 TCP 74 35003 → 80 [SYN] Seq=0 Win=5840 Len=0 MSS=1460 SACK_PERM=1 TSval=199295 TSecr=0 WS=16
   78 151.636311 205.206.231.13 → 192.168.20.140 TCP 1514 80 → 35002 [PSH, ACK] Seq=7301 Ack=408 Win=64240 Len=1460 [TCP segment of a reassembled PDU]
   79 151.636446 192.168.20.140 → 205.206.231.13 TCP 54 35002 → 80 [ACK] Seq=408 Ack=8761 Win=23360 Len=0
   80 151.636521 205.206.231.13 → 192.168.20.140 TCP 1514 80 → 35002 [PSH, ACK] Seq=8761 Ack=408 Win=64240 Len=1460 [TCP segment of a reassembled PDU]
   81 151.636534 192.168.20.140 → 205.206.231.13 TCP 54 35002 → 80 [ACK] Seq=408 Ack=10221 Win=26280 Len=0
   82 151.636572 205.206.231.13 → 192.168.20.140 TCP 1514 80 → 35002 [PSH, ACK] Seq=10221 Ack=408 Win=64240 Len=1460 [TCP segment of a reassembled PDU]
   83 151.636583 192.168.20.140 → 205.206.231.13 TCP 54 35002 → 80 [ACK] Seq=408 Ack=11681 Win=29200 Len=0
   84 151.636624 205.206.231.13 → 192.168.20.140 TCP 1514 80 → 35002 [PSH, ACK] Seq=11681 Ack=408 Win=64240 Len=1460 [TCP segment of a reassembled PDU]
   85 151.636634 192.168.20.140 → 205.206.231.13 TCP 54 35002 → 80 [ACK] Seq=408 Ack=13141 Win=32120 Len=0
   86 151.637025 205.206.231.13 → 192.168.20.140 TCP 1514 80 → 35002 [PSH, ACK] Seq=13141 Ack=408 Win=64240 Len=1460 [TCP segment of a reassembled PDU]
   87 151.637038 192.168.20.140 → 205.206.231.13 TCP 54 35002 → 80 [ACK] Seq=408 Ack=14601 Win=35040 Len=0
   88 151.637339 205.206.231.13 → 192.168.20.140 TCP 1514 80 → 35002 [ACK] Seq=14601 Ack=408 Win=64240 Len=1460 [TCP segment of a reassembled PDU]
   89 151.637396 192.168.20.140 → 205.206.231.13 TCP 54 35002 → 80 [ACK] Seq=408 Ack=16061 Win=37960 Len=0
   90 151.637523 205.206.231.13 → 192.168.20.140 TCP 1514 80 → 35002 [PSH, ACK] Seq=16061 Ack=408 Win=64240 Len=1460 [TCP segment of a reassembled PDU]
   91 151.637533 192.168.20.140 → 205.206.231.13 TCP 54 35002 → 80 [ACK] Seq=408 Ack=17521 Win=40880 Len=0
   92 151.637576 205.206.231.13 → 192.168.20.140 TCP 1514 80 → 35002 [PSH, ACK] Seq=17521 Ack=408 Win=64240 Len=1460 [TCP segment of a reassembled PDU]
   93 151.637587 192.168.20.140 → 205.206.231.13 TCP 54 35002 → 80 [ACK] Seq=408 Ack=18981 Win=43800 Len=0
   94 151.661499 205.206.231.13 → 192.168.20.140 TCP 60 80 → 35003 [SYN, ACK] Seq=0 Ack=1 Win=64240 Len=0 MSS=1460
   95 151.661539 192.168.20.140 → 205.206.231.13 TCP 54 35003 → 80 [ACK] Seq=1 Ack=1 Win=5840 Len=0
   96 151.662040 192.168.20.140 → 205.206.231.13 HTTP 438 GET /new_SFPS_style.css HTTP/1.1 
   97 151.662191 205.206.231.13 → 192.168.20.140 TCP 60 80 → 35003 [ACK] Seq=1 Ack=385 Win=64240 Len=0
   98 151.673055 205.206.231.13 → 192.168.20.140 TCP 1514 80 → 35002 [PSH, ACK] Seq=18981 Ack=408 Win=64240 Len=1460 [TCP segment of a reassembled PDU]
   99 151.673099 192.168.20.140 → 205.206.231.13 TCP 54 35002 → 80 [ACK] Seq=408 Ack=20441 Win=46720 Len=0
  100 151.673370 205.206.231.13 → 192.168.20.140 TCP 1514 80 → 35002 [ACK] Seq=20441 Ack=408 Win=64240 Len=1460 [TCP segment of a reassembled PDU]
  101 151.673382 192.168.20.140 → 205.206.231.13 TCP 54 35002 → 80 [ACK] Seq=408 Ack=21901 Win=49640 Len=0
  102 151.673444 205.206.231.13 → 192.168.20.140 HTTP 1439 HTTP/1.1 200 OK  (text/html)
  103 151.673456 192.168.20.140 → 205.206.231.13 TCP 54 35002 → 80 [ACK] Seq=408 Ack=23286 Win=52560 Len=0
  104 151.701510 205.206.231.13 → 192.168.20.140 TCP 385 HTTP/1.1 200 OK  [TCP segment of a reassembled PDU]
  105 151.701543 192.168.20.140 → 205.206.231.13 TCP 54 35003 → 80 [ACK] Seq=385 Ack=332 Win=6432 Len=0
  106 151.702369 205.206.231.13 → 192.168.20.140 TCP 1183 80 → 35003 [PSH, ACK] Seq=332 Ack=385 Win=64240 Len=1129 [TCP segment of a reassembled PDU]
  107 151.702394 192.168.20.140 → 205.206.231.13 TCP 54 35003 → 80 [ACK] Seq=385 Ack=1461 Win=9032 Len=0
  108 151.738734 205.206.231.13 → 192.168.20.140 TCP 1514 80 → 35003 [PSH, ACK] Seq=1461 Ack=385 Win=64240 Len=1460 [TCP segment of a reassembled PDU]
  109 151.738765 192.168.20.140 → 205.206.231.13 TCP 54 35003 → 80 [ACK] Seq=385 Ack=2921 Win=11680 Len=0
  110 151.739007 205.206.231.13 → 192.168.20.140 TCP 1514 80 → 35003 [PSH, ACK] Seq=2921 Ack=385 Win=64240 Len=1460 [TCP segment of a reassembled PDU]
  111 151.739017 192.168.20.140 → 205.206.231.13 TCP 54 35003 → 80 [ACK] Seq=385 Ack=4381 Win=14600 Len=0
  112 151.739363 205.206.231.13 → 192.168.20.140 TCP 1514 80 → 35003 [PSH, ACK] Seq=4381 Ack=385 Win=64240 Len=1460 [TCP segment of a reassembled PDU]
  113 151.739377 192.168.20.140 → 205.206.231.13 TCP 54 35003 → 80 [ACK] Seq=385 Ack=5841 Win=17520 Len=0
  114 151.739621 205.206.231.13 → 192.168.20.140 TCP 1514 80 → 35003 [PSH, ACK] Seq=5841 Ack=385 Win=64240 Len=1460 [TCP segment of a reassembled PDU]
  115 151.739630 192.168.20.140 → 205.206.231.13 TCP 54 35003 → 80 [ACK] Seq=385 Ack=7301 Win=20440 Len=0
  116 151.775755 205.206.231.13 → 192.168.20.140 TCP 1514 80 → 35003 [PSH, ACK] Seq=7301 Ack=385 Win=64240 Len=1460 [TCP segment of a reassembled PDU]
  117 151.775789 192.168.20.140 → 205.206.231.13 TCP 54 35003 → 80 [ACK] Seq=385 Ack=8761 Win=23360 Len=0
  118 151.775860 205.206.231.13 → 192.168.20.140 TCP 1514 80 → 35003 [PSH, ACK] Seq=8761 Ack=385 Win=64240 Len=1460 [TCP segment of a reassembled PDU]
  119 151.775876 192.168.20.140 → 205.206.231.13 TCP 54 35003 → 80 [ACK] Seq=385 Ack=10221 Win=26280 Len=0
  120 151.776222 205.206.231.13 → 192.168.20.140 TCP 1514 80 → 35003 [PSH, ACK] Seq=10221 Ack=385 Win=64240 Len=1460 [TCP segment of a reassembled PDU]
  121 151.776233 192.168.20.140 → 205.206.231.13 TCP 54 35003 → 80 [ACK] Seq=385 Ack=11681 Win=29200 Len=0
  122 151.776599 205.206.231.13 → 192.168.20.140 TCP 1514 80 → 35003 [ACK] Seq=11681 Ack=385 Win=64240 Len=1460 [TCP segment of a reassembled PDU]
  123 151.776614 192.168.20.140 → 205.206.231.13 TCP 54 35003 → 80 [ACK] Seq=385 Ack=13141 Win=32120 Len=0
  124 151.776693 205.206.231.13 → 192.168.20.140 TCP 1514 80 → 35003 [PSH, ACK] Seq=13141 Ack=385 Win=64240 Len=1460 [TCP segment of a reassembled PDU]
  125 151.776710 192.168.20.140 → 205.206.231.13 TCP 54 35003 → 80 [ACK] Seq=385 Ack=14601 Win=35040 Len=0
  126 151.776988 205.206.231.13 → 192.168.20.140 TCP 1514 80 → 35003 [ACK] Seq=14601 Ack=385 Win=64240 Len=1460 [TCP segment of a reassembled PDU]
  127 151.777000 192.168.20.140 → 205.206.231.13 TCP 54 35003 → 80 [ACK] Seq=385 Ack=16061 Win=37960 Len=0
  128 151.777058 205.206.231.13 → 192.168.20.140 TCP 1514 80 → 35003 [PSH, ACK] Seq=16061 Ack=385 Win=64240 Len=1460 [TCP segment of a reassembled PDU]
  129 151.777071 192.168.20.140 → 205.206.231.13 TCP 54 35003 → 80 [ACK] Seq=385 Ack=17521 Win=40880 Len=0
  130 151.777112 205.206.231.13 → 192.168.20.140 TCP 1514 80 → 35003 [PSH, ACK] Seq=17521 Ack=385 Win=64240 Len=1460 [TCP segment of a reassembled PDU]
  131 151.777123 192.168.20.140 → 205.206.231.13 TCP 54 35003 → 80 [ACK] Seq=385 Ack=18981 Win=43800 Len=0
  132 151.818640 205.206.231.13 → 192.168.20.140 TCP 1514 80 → 35003 [ACK] Seq=18981 Ack=385 Win=64240 Len=1460 [TCP segment of a reassembled PDU]
  133 151.818717 192.168.20.140 → 205.206.231.13 TCP 54 35003 → 80 [ACK] Seq=385 Ack=20441 Win=46720 Len=0
  134 151.818786 205.206.231.13 → 192.168.20.140 TCP 1514 80 → 35003 [PSH, ACK] Seq=20441 Ack=385 Win=64240 Len=1460 [TCP segment of a reassembled PDU]
  135 151.818799 192.168.20.140 → 205.206.231.13 TCP 54 35003 → 80 [ACK] Seq=385 Ack=21901 Win=49640 Len=0
  136 151.818841 205.206.231.13 → 192.168.20.140 TCP 1514 80 → 35003 [ACK] Seq=21901 Ack=385 Win=64240 Len=1460 [TCP segment of a reassembled PDU]
  137 151.818852 192.168.20.140 → 205.206.231.13 TCP 54 35003 → 80 [ACK] Seq=385 Ack=23361 Win=52560 Len=0
  138 151.818890 205.206.231.13 → 192.168.20.140 TCP 1514 80 → 35003 [PSH, ACK] Seq=23361 Ack=385 Win=64240 Len=1460 [TCP segment of a reassembled PDU]
  139 151.818901 192.168.20.140 → 205.206.231.13 TCP 54 35003 → 80 [ACK] Seq=385 Ack=24821 Win=55480 Len=0
  140 151.818943 205.206.231.13 → 192.168.20.140 TCP 1514 80 → 35003 [ACK] Seq=24821 Ack=385 Win=64240 Len=1460 [TCP segment of a reassembled PDU]
  141 151.818956 192.168.20.140 → 205.206.231.13 TCP 54 35003 → 80 [ACK] Seq=385 Ack=26281 Win=58400 Len=0
  142 151.818994 205.206.231.13 → 192.168.20.140 TCP 1514 80 → 35003 [PSH, ACK] Seq=26281 Ack=385 Win=64240 Len=1460 [TCP segment of a reassembled PDU]
  143 151.819004 192.168.20.140 → 205.206.231.13 TCP 54 35003 → 80 [ACK] Seq=385 Ack=27741 Win=56940 Len=0
  144 151.819043 205.206.231.13 → 192.168.20.140 TCP 1514 80 → 35003 [ACK] Seq=27741 Ack=385 Win=64240 Len=1460 [TCP segment of a reassembled PDU]
  145 151.819056 192.168.20.140 → 205.206.231.13 TCP 54 35003 → 80 [ACK] Seq=385 Ack=29201 Win=55480 Len=0
  146 151.819095 205.206.231.13 → 192.168.20.140 HTTP 786 HTTP/1.1 200 OK  (text/css)
  147 151.819128 192.168.20.140 → 205.206.231.13 TCP 54 35003 → 80 [ACK] Seq=385 Ack=29933 Win=54748 Len=0
  148 151.888446 192.168.20.140 → 205.206.231.13 HTTP 454 GET /images/site/header_button_bar.gif HTTP/1.1 
  149 151.888673 205.206.231.13 → 192.168.20.140 TCP 60 80 → 35002 [ACK] Seq=23286 Ack=808 Win=64240 Len=0
  150 151.892559 192.168.20.140 → 192.168.20.2 DNS 86 Standard query 0x0544 A adserver.securityfocus.com
  151 151.894703 192.168.20.140 → 205.206.231.13 HTTP 458 GET /images/threatcon/threatcon_level2.gif HTTP/1.1 
  152 151.895027 205.206.231.13 → 192.168.20.140 TCP 60 80 → 35003 [ACK] Seq=29933 Ack=789 Win=64240 Len=0
  153 151.933779 205.206.231.13 → 192.168.20.140 TCP 384 HTTP/1.1 200 OK  [TCP segment of a reassembled PDU]
  154 151.933843 192.168.20.140 → 205.206.231.13 TCP 54 35002 → 80 [ACK] Seq=808 Ack=23616 Win=55480 Len=0
  155 151.934226 205.206.231.13 → 192.168.20.140 HTTP 1084 HTTP/1.1 200 OK  (GIF89a)
  156 151.934239 192.168.20.140 → 205.206.231.13 TCP 54 35002 → 80 [ACK] Seq=808 Ack=24646 Win=58400 Len=0
  157 151.935778 205.206.231.13 → 192.168.20.140 TCP 384 HTTP/1.1 200 OK  [TCP segment of a reassembled PDU]
  158 151.935796 192.168.20.140 → 205.206.231.13 TCP 54 35003 → 80 [ACK] Seq=789 Ack=30263 Win=61320 Len=0
  159 151.936955 205.206.231.13 → 192.168.20.140 TCP 1514 80 → 35003 [PSH, ACK] Seq=30263 Ack=789 Win=64240 Len=1460 [TCP segment of a reassembled PDU]
  160 151.936971 192.168.20.140 → 205.206.231.13 TCP 54 35003 → 80 [ACK] Seq=789 Ack=31723 Win=62780 Len=0
  161 151.937035 205.206.231.13 → 192.168.20.140 TCP 1514 80 → 35003 [ACK] Seq=31723 Ack=789 Win=64240 Len=1460 [TCP segment of a reassembled PDU]
  162 151.937052 205.206.231.13 → 192.168.20.140 HTTP 192 HTTP/1.1 200 OK  (GIF89a)
  163 151.939036 192.168.20.140 → 205.206.231.13 TCP 54 35003 → 80 [ACK] Seq=789 Ack=33321 Win=62780 Len=0
  164 151.939431 192.168.20.140 → 205.206.231.13 HTTP 443 GET /images/site/search.gif HTTP/1.1 
  165 151.939587 205.206.231.13 → 192.168.20.140 TCP 60 80 → 35002 [ACK] Seq=24646 Ack=1197 Win=64240 Len=0
  166 151.939850 192.168.20.140 → 205.206.231.13 HTTP 444 GET /images/site/indepth.gif HTTP/1.1 
  167 151.939987 205.206.231.13 → 192.168.20.140 TCP 60 80 → 35003 [ACK] Seq=33321 Ack=1179 Win=64240 Len=0
  168 151.962526 192.168.20.2 → 192.168.20.140 DNS 102 Standard query response 0x0544 A adserver.securityfocus.com A 205.206.231.22
  169 151.963089 192.168.20.140 → 205.206.231.22 TCP 74 47980 → 80 [SYN] Seq=0 Win=5840 Len=0 MSS=1460 SACK_PERM=1 TSval=199381 TSecr=0 WS=16
  170 151.963351 192.168.20.140 → 205.206.231.22 TCP 74 47981 → 80 [SYN] Seq=0 Win=5840 Len=0 MSS=1460 SACK_PERM=1 TSval=199381 TSecr=0 WS=16
  171 151.977975 205.206.231.13 → 192.168.20.140 HTTP 715 HTTP/1.1 200 OK  (GIF89a)
  172 151.978011 205.206.231.13 → 192.168.20.140 HTTP 465 HTTP/1.1 200 OK  (GIF89a)
  173 151.978608 192.168.20.140 → 205.206.231.13 HTTP 456 GET /images/authors/small/oliver-day.jpg HTTP/1.1 
  174 151.978771 205.206.231.13 → 192.168.20.140 TCP 60 80 → 35002 [ACK] Seq=25307 Ack=1599 Win=64240 Len=0
  175 151.979002 192.168.20.140 → 205.206.231.13 HTTP 453 GET /images/authors/small/wysopal.jpg HTTP/1.1 
  176 151.979142 205.206.231.13 → 192.168.20.140 TCP 60 80 → 35003 [ACK] Seq=33732 Ack=1578 Win=64240 Len=0
  177 152.000160 205.206.231.22 → 192.168.20.140 TCP 60 80 → 47980 [SYN, ACK] Seq=0 Ack=1 Win=64240 Len=0 MSS=1460
  178 152.000207 192.168.20.140 → 205.206.231.22 TCP 54 47980 → 80 [ACK] Seq=1 Ack=1 Win=5840 Len=0
  179 152.000648 205.206.231.22 → 192.168.20.140 TCP 60 80 → 47981 [SYN, ACK] Seq=0 Ack=1 Win=64240 Len=0 MSS=1460
  180 152.000660 192.168.20.140 → 205.206.231.22 TCP 54 47981 → 80 [ACK] Seq=1 Ack=1 Win=5840 Len=0
  181 152.001135 192.168.20.140 → 205.206.231.22 HTTP 489 GET /RealMedia/ads/adstream_nx.cgi/www.securityfocus.com/home@Right1 HTTP/1.1 
  182 152.001348 205.206.231.22 → 192.168.20.140 TCP 60 80 → 47981 [ACK] Seq=1 Ack=436 Win=64240 Len=0
  183 152.001466 192.168.20.140 → 205.206.231.22 HTTP 486 GET /RealMedia/ads/adstream_nx.cgi/www.securityfocus.com/home@Top HTTP/1.1 
  184 152.001603 205.206.231.22 → 192.168.20.140 TCP 60 80 → 47980 [ACK] Seq=1 Ack=433 Win=64240 Len=0
  185 152.018546 205.206.231.13 → 192.168.20.140 TCP 385 HTTP/1.1 200 OK  [TCP segment of a reassembled PDU]
  186 152.018902 205.206.231.13 → 192.168.20.140 HTTP 1393 HTTP/1.1 200 OK  (JPEG JFIF image)
  187 152.018929 192.168.20.140 → 205.206.231.13 TCP 54 35002 → 80 [ACK] Seq=1599 Ack=26977 Win=62780 Len=0
  188 152.019005 205.206.231.13 → 192.168.20.140 TCP 385 HTTP/1.1 200 OK  [TCP segment of a reassembled PDU]
  189 152.019753 192.168.20.140 → 205.206.231.13 HTTP 442 GET /images/site/blogs.gif HTTP/1.1 
  190 152.019913 205.206.231.13 → 192.168.20.140 TCP 60 80 → 35002 [ACK] Seq=26977 Ack=1987 Win=64240 Len=0
  191 152.020280 205.206.231.13 → 192.168.20.140 HTTP 1346 HTTP/1.1 200 OK  (JPEG JFIF image)
  192 152.020291 192.168.20.140 → 205.206.231.13 TCP 54 35003 → 80 [ACK] Seq=1578 Ack=35355 Win=62780 Len=0
  193 152.020687 192.168.20.140 → 205.206.231.13 HTTP 446 GET /images/site/incidents.gif HTTP/1.1 
  194 152.020899 205.206.231.13 → 192.168.20.140 TCP 60 80 → 35003 [ACK] Seq=35355 Ack=1970 Win=64240 Len=0
  195 152.040361 205.206.231.22 → 192.168.20.140 HTTP 491 HTTP/1.1 200 OK  (GIF89a)
  196 152.040402 192.168.20.140 → 205.206.231.22 TCP 54 47981 → 80 [ACK] Seq=436 Ack=438 Win=6432 Len=0
  197 152.041319 192.168.20.140 → 205.206.231.22 HTTP 486 GET /RealMedia/ads/adstream_nx.cgi/www.securityfocus.com/home@x28 HTTP/1.1 
  198 152.041495 205.206.231.22 → 192.168.20.140 TCP 60 80 → 47981 [ACK] Seq=438 Ack=868 Win=64240 Len=0
  199 152.041730 205.206.231.22 → 192.168.20.140 TCP 409 HTTP/1.1 200 OK  [TCP segment of a reassembled PDU]
  200 152.041745 192.168.20.140 → 205.206.231.22 TCP 54 47980 → 80 [ACK] Seq=433 Ack=356 Win=6432 Len=0
  201 152.043344 205.206.231.22 → 192.168.20.140 TCP 1514 80 → 47980 [PSH, ACK] Seq=356 Ack=433 Win=64240 Len=1460 [TCP segment of a reassembled PDU]
  202 152.043369 192.168.20.140 → 205.206.231.22 TCP 54 47980 → 80 [ACK] Seq=433 Ack=1816 Win=8760 Len=0
  203 152.058478 205.206.231.13 → 192.168.20.140 TCP 384 HTTP/1.1 200 OK  [TCP segment of a reassembled PDU]
  204 152.059418 205.206.231.13 → 192.168.20.140 HTTP 1108 HTTP/1.1 200 OK  (GIF89a)
  205 152.059964 192.168.20.140 → 205.206.231.13 TCP 54 35002 → 80 [ACK] Seq=1987 Ack=28361 Win=62780 Len=0
  206 152.060302 192.168.20.140 → 205.206.231.13 HTTP 448 GET /images/site/foundations.gif HTTP/1.1 
  207 152.060520 205.206.231.13 → 192.168.20.140 HTTP 791 HTTP/1.1 200 OK  (GIF89a)
  208 152.060539 205.206.231.13 → 192.168.20.140 TCP 60 80 → 35002 [ACK] Seq=28361 Ack=2381 Win=64240 Len=0
  209 152.060965 192.168.20.140 → 205.206.231.13 HTTP 446 GET /images/site/subscribe.gif HTTP/1.1 
  210 152.061109 205.206.231.13 → 192.168.20.140 TCP 60 80 → 35003 [ACK] Seq=36092 Ack=2362 Win=64240 Len=0
  211 152.081701 205.206.231.22 → 192.168.20.140 TCP 1514 80 → 47980 [PSH, ACK] Seq=1816 Ack=433 Win=64240 Len=1460 [TCP segment of a reassembled PDU]
  212 152.081737 192.168.20.140 → 205.206.231.22 TCP 54 47980 → 80 [ACK] Seq=433 Ack=3276 Win=11680 Len=0
  213 152.081806 205.206.231.22 → 192.168.20.140 TCP 1514 80 → 47980 [PSH, ACK] Seq=3276 Ack=433 Win=64240 Len=1460 [TCP segment of a reassembled PDU]
  214 152.081821 192.168.20.140 → 205.206.231.22 TCP 54 47980 → 80 [ACK] Seq=433 Ack=4736 Win=14600 Len=0
  215 152.081862 205.206.231.22 → 192.168.20.140 TCP 1514 80 → 47980 [PSH, ACK] Seq=4736 Ack=433 Win=64240 Len=1460 [TCP segment of a reassembled PDU]
  216 152.081877 192.168.20.140 → 205.206.231.22 TCP 54 47980 → 80 [ACK] Seq=433 Ack=6196 Win=17520 Len=0
  217 152.081915 205.206.231.22 → 192.168.20.140 TCP 1514 80 → 47980 [PSH, ACK] Seq=6196 Ack=433 Win=64240 Len=1460 [TCP segment of a reassembled PDU]
  218 152.081984 192.168.20.140 → 205.206.231.22 TCP 54 47980 → 80 [ACK] Seq=433 Ack=7656 Win=20440 Len=0
  219 152.082034 205.206.231.22 → 192.168.20.140 HTTP 490 HTTP/1.1 200 OK  (GIF89a)
  220 152.089129 192.168.20.140 → 205.206.231.22 HTTP 489 GET /RealMedia/ads/adstream_nx.cgi/www.securityfocus.com/home@Middle HTTP/1.1 
  221 152.089519 205.206.231.22 → 192.168.20.140 TCP 60 80 → 47981 [ACK] Seq=874 Ack=1303 Win=64240 Len=0
  222 152.100166 205.206.231.13 → 192.168.20.140 HTTP 733 HTTP/1.1 200 OK  (GIF89a)
  223 152.100631 192.168.20.140 → 205.206.231.13 HTTP 442 GET /images/site/trans.gif HTTP/1.1 
  224 152.102568 205.206.231.13 → 192.168.20.140 TCP 60 80 → 35002 [ACK] Seq=29040 Ack=2769 Win=64240 Len=0
  225 152.114380 205.206.231.13 → 192.168.20.140 HTTP 780 HTTP/1.1 200 OK  (GIF89a)
  226 152.115519 192.168.20.140 → 205.206.231.13 HTTP 440 GET /images/site/idg.gif HTTP/1.1 
  227 152.115743 205.206.231.13 → 192.168.20.140 TCP 60 80 → 35003 [ACK] Seq=36818 Ack=2748 Win=64240 Len=0
  228 152.121747 205.206.231.22 → 192.168.20.140 TCP 1514 80 → 47980 [PSH, ACK] Seq=7656 Ack=433 Win=64240 Len=1460 [TCP segment of a reassembled PDU]
  229 152.121812 192.168.20.140 → 205.206.231.22 TCP 54 47980 → 80 [ACK] Seq=433 Ack=9116 Win=23360 Len=0
  230 152.121942 205.206.231.22 → 192.168.20.140 TCP 1514 80 → 47980 [PSH, ACK] Seq=9116 Ack=433 Win=64240 Len=1460 [TCP segment of a reassembled PDU]
  231 152.121984 192.168.20.140 → 205.206.231.22 TCP 54 47980 → 80 [ACK] Seq=433 Ack=10576 Win=26280 Len=0
  232 152.122063 205.206.231.22 → 192.168.20.140 TCP 1514 80 → 47980 [PSH, ACK] Seq=10576 Ack=433 Win=64240 Len=1460 [TCP segment of a reassembled PDU]
  233 152.122100 192.168.20.140 → 205.206.231.22 TCP 54 47980 → 80 [ACK] Seq=433 Ack=12036 Win=29200 Len=0
  234 152.122140 205.206.231.22 → 192.168.20.140 TCP 1159 80 → 47980 [PSH, ACK] Seq=12036 Ack=433 Win=64240 Len=1105 [TCP segment of a reassembled PDU]
  235 152.122191 192.168.20.140 → 205.206.231.22 TCP 54 47980 → 80 [ACK] Seq=433 Ack=13141 Win=32120 Len=0
  236 152.122237 205.206.231.22 → 192.168.20.140 TCP 1514 80 → 47980 [PSH, ACK] Seq=13141 Ack=433 Win=64240 Len=1460 [TCP segment of a reassembled PDU]
  237 152.122254 192.168.20.140 → 205.206.231.22 TCP 54 47980 → 80 [ACK] Seq=433 Ack=14601 Win=35040 Len=0
  238 152.122439 205.206.231.22 → 192.168.20.140 TCP 1514 80 → 47980 [PSH, ACK] Seq=14601 Ack=433 Win=64240 Len=1460 [TCP segment of a reassembled PDU]
  239 152.122454 192.168.20.140 → 205.206.231.22 TCP 54 47980 → 80 [ACK] Seq=433 Ack=16061 Win=37960 Len=0
  240 152.122618 205.206.231.22 → 192.168.20.140 TCP 1514 80 → 47980 [PSH, ACK] Seq=16061 Ack=433 Win=64240 Len=1460 [TCP segment of a reassembled PDU]
  241 152.122630 192.168.20.140 → 205.206.231.22 TCP 54 47980 → 80 [ACK] Seq=433 Ack=17521 Win=40880 Len=0
  242 152.122669 205.206.231.22 → 192.168.20.140 TCP 1514 80 → 47980 [PSH, ACK] Seq=17521 Ack=433 Win=64240 Len=1460 [TCP segment of a reassembled PDU]
  243 152.122680 192.168.20.140 → 205.206.231.22 TCP 54 47980 → 80 [ACK] Seq=433 Ack=18981 Win=43800 Len=0
  244 152.128222 205.206.231.22 → 192.168.20.140 TCP 408 HTTP/1.1 200 OK  [TCP segment of a reassembled PDU]
  245 152.128876 205.206.231.22 → 192.168.20.140 TCP 1514 80 → 47981 [ACK] Seq=1228 Ack=1303 Win=64240 Len=1460 [TCP segment of a reassembled PDU]
  246 152.128893 192.168.20.140 → 205.206.231.22 TCP 54 47981 → 80 [ACK] Seq=1303 Ack=2688 Win=11680 Len=0
  247 152.128956 205.206.231.22 → 192.168.20.140 TCP 1160 80 → 47981 [PSH, ACK] Seq=2688 Ack=1303 Win=64240 Len=1106 [TCP segment of a reassembled PDU]
  248 152.139988 205.206.231.13 → 192.168.20.140 HTTP 424 HTTP/1.1 200 OK  (GIF89a)
  249 152.140443 192.168.20.140 → 205.206.231.13 HTTP 465 GET /images/site/list_arrow.gif HTTP/1.1 
  250 152.140734 205.206.231.13 → 192.168.20.140 TCP 60 80 → 35002 [ACK] Seq=29410 Ack=3180 Win=64240 Len=0
  251 152.158012 205.206.231.22 → 192.168.20.140 TCP 1514 80 → 47980 [PSH, ACK] Seq=18981 Ack=433 Win=64240 Len=1460 [TCP segment of a reassembled PDU]
  252 152.158049 192.168.20.140 → 205.206.231.22 TCP 54 47980 → 80 [ACK] Seq=433 Ack=20441 Win=46720 Len=0
  253 152.158526 205.206.231.22 → 192.168.20.140 TCP 1514 80 → 47980 [PSH, ACK] Seq=20441 Ack=433 Win=64240 Len=1460 [TCP segment of a reassembled PDU]
  254 152.158540 192.168.20.140 → 205.206.231.22 TCP 54 47980 → 80 [ACK] Seq=433 Ack=21901 Win=49640 Len=0
  255 152.158810 205.206.231.22 → 192.168.20.140 TCP 1514 80 → 47980 [PSH, ACK] Seq=21901 Ack=433 Win=64240 Len=1460 [TCP segment of a reassembled PDU]
  256 152.158819 192.168.20.140 → 205.206.231.22 TCP 54 47980 → 80 [ACK] Seq=433 Ack=23361 Win=52560 Len=0
  257 152.159153 205.206.231.22 → 192.168.20.140 TCP 1514 80 → 47980 [PSH, ACK] Seq=23361 Ack=433 Win=64240 Len=1460 [TCP segment of a reassembled PDU]
  258 152.159170 192.168.20.140 → 205.206.231.22 TCP 54 47980 → 80 [ACK] Seq=433 Ack=24821 Win=55480 Len=0
  259 152.159290 205.206.231.22 → 192.168.20.140 TCP 1514 80 → 47980 [PSH, ACK] Seq=24821 Ack=433 Win=64240 Len=1460 [TCP segment of a reassembled PDU]
  260 152.159302 192.168.20.140 → 205.206.231.22 TCP 54 47980 → 80 [ACK] Seq=433 Ack=26281 Win=58400 Len=0
  261 152.159359 205.206.231.22 → 192.168.20.140 TCP 1514 80 → 47980 [PSH, ACK] Seq=26281 Ack=433 Win=64240 Len=1460 [TCP segment of a reassembled PDU]
  262 152.159466 192.168.20.140 → 205.206.231.22 TCP 54 47980 → 80 [ACK] Seq=433 Ack=27741 Win=56940 Len=0
  263 152.159535 205.206.231.22 → 192.168.20.140 TCP 1514 80 → 47980 [PSH, ACK] Seq=27741 Ack=433 Win=64240 Len=1460 [TCP segment of a reassembled PDU]
  264 152.159545 192.168.20.140 → 205.206.231.22 TCP 54 47980 → 80 [ACK] Seq=433 Ack=29201 Win=55480 Len=0
  265 152.163839 205.206.231.13 → 192.168.20.140 TCP 1514 HTTP/1.1 200 OK  [TCP segment of a reassembled PDU]
  266 152.163873 205.206.231.13 → 192.168.20.140 TCP 1514 80 → 35003 [ACK] Seq=38278 Ack=2748 Win=64240 Len=1460 [TCP segment of a reassembled PDU]
  267 152.163889 192.168.20.140 → 205.206.231.13 TCP 54 35003 → 80 [ACK] Seq=2748 Ack=39738 Win=62780 Len=0
  268 152.163956 205.206.231.13 → 192.168.20.140 HTTP 1430 HTTP/1.1 200 OK  (GIF89a)
  269 152.163970 205.206.231.22 → 192.168.20.140 TCP 1514 80 → 47980 [ACK] Seq=29201 Ack=433 Win=64240 Len=1460 [TCP segment of a reassembled PDU]
  270 152.163981 192.168.20.140 → 205.206.231.22 TCP 54 47980 → 80 [ACK] Seq=433 Ack=30661 Win=61320 Len=0
  271 152.164019 205.206.231.22 → 192.168.20.140 TCP 1514 80 → 47980 [ACK] Seq=30661 Ack=433 Win=64240 Len=1460 [TCP segment of a reassembled PDU]
  272 152.164030 192.168.20.140 → 205.206.231.22 TCP 54 47980 → 80 [ACK] Seq=433 Ack=32121 Win=62780 Len=0
  273 152.164068 205.206.231.22 → 192.168.20.140 TCP 1514 80 → 47980 [ACK] Seq=32121 Ack=433 Win=64240 Len=1460 [TCP segment of a reassembled PDU]
  274 152.164082 192.168.20.140 → 205.206.231.22 TCP 54 47980 → 80 [ACK] Seq=433 Ack=33581 Win=61320 Len=0
  275 152.164121 205.206.231.22 → 192.168.20.140 TCP 1514 80 → 47980 [ACK] Seq=33581 Ack=433 Win=64240 Len=1460 [TCP segment of a reassembled PDU]
  276 152.164131 192.168.20.140 → 205.206.231.22 TCP 54 47980 → 80 [ACK] Seq=433 Ack=35041 Win=59860 Len=0
  277 152.164174 205.206.231.22 → 192.168.20.140 HTTP 447 HTTP/1.1 200 OK  (GIF89a)
  278 152.164890 192.168.20.140 → 205.206.231.22 TCP 54 47980 → 80 [ACK] Seq=433 Ack=35434 Win=62780 Len=0
  279 152.165365 192.168.20.140 → 205.206.231.13 HTTP 466 GET /images/site/list_arrow2.gif HTTP/1.1 
  280 152.165767 205.206.231.13 → 192.168.20.140 TCP 60 80 → 35003 [ACK] Seq=41114 Ack=3160 Win=64240 Len=0
  281 152.165985 205.206.231.22 → 192.168.20.140 TCP 1514 80 → 47981 [PSH, ACK] Seq=3794 Ack=1303 Win=64240 Len=1460 [TCP segment of a reassembled PDU]
  282 152.165999 192.168.20.140 → 205.206.231.22 TCP 54 47981 → 80 [ACK] Seq=1303 Ack=5254 Win=17520 Len=0
  283 152.166065 205.206.231.22 → 192.168.20.140 TCP 1514 80 → 47981 [PSH, ACK] Seq=5254 Ack=1303 Win=64240 Len=1460 [TCP segment of a reassembled PDU]
  284 152.166503 205.206.231.22 → 192.168.20.140 TCP 1514 80 → 47981 [PSH, ACK] Seq=6714 Ack=1303 Win=64240 Len=1460 [TCP segment of a reassembled PDU]
  285 152.166514 192.168.20.140 → 205.206.231.22 TCP 54 47981 → 80 [ACK] Seq=1303 Ack=8174 Win=23360 Len=0
  286 152.178544 205.206.231.13 → 192.168.20.140 HTTP 431 HTTP/1.1 200 OK  (GIF89a)
  287 152.179081 192.168.20.140 → 205.206.231.13 HTTP 461 GET /images/site/sf_new.gif HTTP/1.1 
  288 152.180698 205.206.231.13 → 192.168.20.140 TCP 60 80 → 35002 [ACK] Seq=29787 Ack=3587 Win=64240 Len=0
  289 152.203383 205.206.231.22 → 192.168.20.140 TCP 1514 80 → 47981 [PSH, ACK] Seq=8174 Ack=1303 Win=64240 Len=1460 [TCP segment of a reassembled PDU]
  290 152.203421 205.206.231.22 → 192.168.20.140 TCP 1514 80 → 47981 [PSH, ACK] Seq=9634 Ack=1303 Win=64240 Len=1460 [TCP segment of a reassembled PDU]
  291 152.203437 192.168.20.140 → 205.206.231.22 TCP 54 47981 → 80 [ACK] Seq=1303 Ack=11094 Win=29200 Len=0
  292 152.203577 205.206.231.22 → 192.168.20.140 TCP 1514 80 → 47981 [PSH, ACK] Seq=11094 Ack=1303 Win=64240 Len=1460 [TCP segment of a reassembled PDU]
  293 152.203639 205.206.231.22 → 192.168.20.140 TCP 1514 80 → 47981 [PSH, ACK] Seq=12554 Ack=1303 Win=64240 Len=1460 [TCP segment of a reassembled PDU]
  294 152.203687 192.168.20.140 → 205.206.231.22 TCP 54 47981 → 80 [ACK] Seq=1303 Ack=14014 Win=35040 Len=0
  295 152.203729 205.206.231.13 → 192.168.20.140 TCP 381 HTTP/1.1 200 OK  [TCP segment of a reassembled PDU]
  296 152.203744 205.206.231.22 → 192.168.20.140 TCP 1514 80 → 47981 [PSH, ACK] Seq=14014 Ack=1303 Win=64240 Len=1460 [TCP segment of a reassembled PDU]
  297 152.205165 205.206.231.13 → 192.168.20.140 HTTP 102 HTTP/1.1 200 OK  (GIF89a)
  298 152.205191 205.206.231.22 → 192.168.20.140 TCP 1514 80 → 47981 [PSH, ACK] Seq=15474 Ack=1303 Win=64240 Len=1460 [TCP segment of a reassembled PDU]
  299 152.205206 192.168.20.140 → 205.206.231.22 TCP 54 47981 → 80 [ACK] Seq=1303 Ack=16934 Win=40880 Len=0
  300 152.205679 192.168.20.140 → 205.206.231.13 TCP 54 35003 → 80 [ACK] Seq=3160 Ack=41489 Win=62780 Len=0
  301 152.205970 192.168.20.140 → 205.206.231.13 HTTP 465 GET /images/site/header_bar.gif HTTP/1.1 
  302 152.206352 205.206.231.13 → 192.168.20.140 TCP 60 80 → 35003 [ACK] Seq=41489 Ack=3571 Win=64240 Len=0
  303 152.217248 205.206.231.13 → 192.168.20.140 TCP 384 HTTP/1.1 200 OK  [TCP segment of a reassembled PDU]
  304 152.218157 205.206.231.13 → 192.168.20.140 TCP 1184 80 → 35002 [PSH, ACK] Seq=30117 Ack=3587 Win=64240 Len=1130 [TCP segment of a reassembled PDU]
  305 152.218545 192.168.20.140 → 205.206.231.13 TCP 54 35002 → 80 [ACK] Seq=3587 Ack=31247 Win=62780 Len=0
  306 152.218677 205.206.231.13 → 192.168.20.140 TCP 1514 80 → 35002 [PSH, ACK] Seq=31247 Ack=3587 Win=64240 Len=1460 [TCP segment of a reassembled PDU]
  307 152.243934 205.206.231.22 → 192.168.20.140 TCP 1514 80 → 47981 [ACK] Seq=16934 Ack=1303 Win=64240 Len=1460 [TCP segment of a reassembled PDU]
  308 152.243984 205.206.231.22 → 192.168.20.140 TCP 1514 80 → 47981 [ACK] Seq=18394 Ack=1303 Win=64240 Len=1460 [TCP segment of a reassembled PDU]
  309 152.244008 192.168.20.140 → 205.206.231.22 TCP 54 47981 → 80 [ACK] Seq=1303 Ack=19854 Win=46720 Len=0
  310 152.244126 205.206.231.22 → 192.168.20.140 TCP 1514 80 → 47981 [ACK] Seq=19854 Ack=1303 Win=64240 Len=1460 [TCP segment of a reassembled PDU]
  311 152.244142 205.206.231.22 → 192.168.20.140 HTTP 977 HTTP/1.1 200 OK  (GIF89a)
  312 152.244153 192.168.20.140 → 205.206.231.22 TCP 54 47981 → 80 [ACK] Seq=1303 Ack=22237 Win=52560 Len=0
  313 152.244191 205.206.231.13 → 192.168.20.140 HTTP 618 HTTP/1.1 200 OK  (GIF89a)
  314 152.245018 192.168.20.140 → 205.206.231.13 HTTP 471 GET /images/site/news_header_left.gif HTTP/1.1 
  315 152.245180 205.206.231.13 → 192.168.20.140 TCP 60 80 → 35003 [ACK] Seq=42053 Ack=3988 Win=64240 Len=0
  316 152.255301 205.206.231.13 → 192.168.20.140 TCP 1514 80 → 35002 [ACK] Seq=32707 Ack=3587 Win=64240 Len=1460 [TCP segment of a reassembled PDU]
  317 152.255338 192.168.20.140 → 205.206.231.13 TCP 54 35002 → 80 [ACK] Seq=3587 Ack=34167 Win=62780 Len=0
  318 152.255405 205.206.231.13 → 192.168.20.140 HTTP 67 HTTP/1.1 200 OK  (GIF89a)
  319 152.256026 192.168.20.140 → 205.206.231.13 HTTP 473 GET /images/site/column_header_left.gif HTTP/1.1 
  320 152.256177 205.206.231.13 → 192.168.20.140 TCP 60 80 → 35002 [ACK] Seq=34180 Ack=4006 Win=64240 Len=0
  321 152.284034 205.206.231.13 → 192.168.20.140 HTTP 467 HTTP/1.1 200 OK  (GIF89a)
  322 152.294583 205.206.231.13 → 192.168.20.140 HTTP 435 HTTP/1.1 200 OK  (GIF89a)
  323 152.323541 192.168.20.140 → 205.206.231.13 TCP 54 35003 → 80 [ACK] Seq=3988 Ack=42466 Win=62780 Len=0
  324 152.332134 192.168.20.140 → 205.206.231.13 TCP 54 35002 → 80 [ACK] Seq=4006 Ack=34561 Win=62780 Len=0
  325 152.431802 192.168.20.140 → 205.206.231.13 HTTP 423 GET /favicon.ico HTTP/1.1 
  326 152.431999 205.206.231.13 → 192.168.20.140 TCP 60 80 → 35003 [ACK] Seq=42466 Ack=4357 Win=64240 Len=0
  327 152.513233 205.206.231.13 → 192.168.20.140 TCP 386 HTTP/1.1 200 OK  [TCP segment of a reassembled PDU]
  328 152.513266 192.168.20.140 → 205.206.231.13 TCP 54 35003 → 80 [ACK] Seq=4357 Ack=42798 Win=62780 Len=0
  329 152.513524 205.206.231.13 → 192.168.20.140 HTTP 948 HTTP/1.1 200 OK  (image/x-icon)
  330 152.513537 192.168.20.140 → 205.206.231.13 TCP 54 35003 → 80 [ACK] Seq=4357 Ack=43692 Win=62780 Len=0
  331 156.075834 192.168.20.140 → 205.206.231.13 TCP 54 35003 → 80 [FIN, ACK] Seq=4357 Ack=43692 Win=62780 Len=0
  332 156.076035 205.206.231.13 → 192.168.20.140 TCP 60 80 → 35003 [ACK] Seq=43692 Ack=4358 Win=64239 Len=0
  333 156.077207 192.168.20.140 → 205.206.231.13 TCP 54 35002 → 80 [FIN, ACK] Seq=4006 Ack=34561 Win=62780 Len=0
  334 156.077337 205.206.231.13 → 192.168.20.140 TCP 60 80 → 35002 [ACK] Seq=34561 Ack=4007 Win=64239 Len=0
  335 156.078117 192.168.20.140 → 205.206.231.13 TCP 74 35006 → 80 [SYN] Seq=0 Win=5840 Len=0 MSS=1460 SACK_PERM=1 TSval=200410 TSecr=0 WS=16
  336 156.111092 205.206.231.13 → 192.168.20.140 TCP 60 80 → 35003 [FIN, PSH, ACK] Seq=43692 Ack=4358 Win=64239 Len=0
  337 156.111608 192.168.20.140 → 205.206.231.13 TCP 54 35003 → 80 [ACK] Seq=4358 Ack=43693 Win=62780 Len=0
  338 156.112906 205.206.231.13 → 192.168.20.140 TCP 60 80 → 35002 [FIN, PSH, ACK] Seq=34561 Ack=4007 Win=64239 Len=0
